{
  "id": "Spitfire_1900",
  "description": "Imported from spitfire.txt",
  "strength": {
    "targetElo": 1900,
    "useWeakening": true,
    "searchSkill": 10,
    "selectivity": 175,
    "slowMover": 100
  },
  "books": {
    "guideBookFile": "guide/active.bin",
    "mainBookFile": "rodent.bin",
    "maxGuideBookPly": 6,
    "maxMainBookPly": 6,
    "bookFilter": 20
  },
  "time": {
    "timePercentage": 100,
    "timeNervousness": 75,
    "blitzHustle": 70,
    "minThinkTimePercent": 100
  },
  "taunts": {
    "enabled": true,
    "tauntFile": "taunts.txt",
    "intensity": 65,
    "rudeness": 70,
    "whenLosing": 50,
    "userBlunderDelta": 200,
    "engineBlunderDelta": 200,
    "smallGainMin": 30,
    "smallGainMax": 60,
    "balanceWindow": 15,
    "advantageThreshold": 50,
    "winningThreshold": 100,
    "crushingThreshold": 300
  }
}
