{
  "id": "WSP_Hustler_1800",
  "description": "Imported from ws_hustler.txt",
  "strength": {
    "targetElo": 1800,
    "useWeakening": true,
    "searchSkill": 8,
    "selectivity": 170,
    "slowMover": 110
  },
  "books": {
    "guideBookFile": "ph-gambitbook.bin",
    "mainBookFile": "rodent.bin",
    "maxGuideBookPly": 3,
    "maxMainBookPly": 3,
    "bookFilter": 20
  },
  "time": {
    "timePercentage": 110,
    "timeNervousness": 80,
    "blitzHustle": 80,
    "minThinkTimePercent": 100
  },
  "taunts": {
    "enabled": true,
    "tauntFile": "taunts_ws_hustler.txt",
    "intensity": 75,
    "rudeness": 80,
    "whenLosing": 60,
    "userBlunderDelta": 200,
    "engineBlunderDelta": 200,
    "smallGainMin": 30,
    "smallGainMax": 60,
    "balanceWindow": 15,
    "advantageThreshold": 50,
    "winningThreshold": 100,
    "crushingThreshold": 300
  }
}
